{
  "$schema": "../brand.schema.json",
  "appName": "AlloPlace",
  "logo": "logo.svg",
  "emailLogo": "logo-email.png",
  "ogImage": "og.png",
  "accentColor": "#FFD100",
  "links": {
    "site": "https://alloplace.com",
    "terms": "https://alloplace.com/legal/terms",
    "privacy": "https://alloplace.com/legal/privacy",
    "docs": "https://alloplace.com",
    "zapier": "https://zapier.com/developer/public-invite/248757/519757/3b7d782a7813340d4cbcb4f8fa6f3294/"
  },
  "contactEmail": "support@alloplace.com",
  "environments": {
    "dev*": { "appNameSuffix": " (dev)", "indexing": false },
    "test*": { "appNameSuffix": " (test)", "indexing": false }
  }
}
